{
  "schema": "runtime-env/carrier-policy/v1",
  "id": "codex-cli-native-isolation",
  "summary": "Codex CLI native sandbox, approval, and environment controls without Claude state inheritance.",
  "carrier": "codex-cli",
  "config_home_env": "CODEX_HOME",
  "settings_file": "config.toml",
  "required_settings": {
    "sandbox_mode": "workspace-write",
    "approval_policy": "on-request",
    "shell_environment_policy.inherit": "none",
    "shell_environment_policy.ignore_default_excludes": false
  },
  "forbidden_environment": ["ANTHROPIC_API_KEY", "CLAUDE_CODE_OAUTH_TOKEN", "CLAUDE_CONFIG_DIR"],
  "external_requirements": ["Use OpenShell, a managed Codex App worktree sandbox, or another OS policy to deny read access to runtime-env dotenv and other carrier homes; Codex native workspace-write is not an arbitrary deny-read policy."],
  "receipt_commands": ["codex login status", "codex -C <existing-worktree> doctor --json"]
}
